{
  "$schema": "./catalog.schema.json",
  "name": "meatballs-five",
  "ini_filename": "pack5.ini",
  "dedicated_workshop_items": false,
  "items": [
    {
      "kind": "mod",
      "id": "MeatballsLibraries",
      "name": "MEATBALLS Libraries (B42.20)",
      "source": "workshop",
      "enabled": true,
      "workshop_id": "3796197817",
      "notes": "5-pack #1. https://steamcommunity.com/sharedfiles/filedetails/?id=3796197817 Load first. XLGAMES: FTP folder, do not write WorkshopItems=."
    },
    {
      "kind": "mod",
      "id": "MeatballsCore",
      "name": "MEATBALLS Core (B42.20)",
      "source": "workshop",
      "enabled": true,
      "workshop_id": "3796206775",
      "notes": "5-pack #2. https://steamcommunity.com/sharedfiles/filedetails/?id=3796206775 require=MeatballsLibraries 3796197817. XLGAMES: FTP folder, do not write WorkshopItems=."
    },
    {
      "kind": "mod",
      "id": "MeatballsKI5",
      "name": "MEATBALLS KI5 Garage (B42.20)",
      "source": "workshop",
      "enabled": true,
      "workshop_id": "3796212345",
      "notes": "5-pack #3. https://steamcommunity.com/sharedfiles/filedetails/?id=3796212345 require=MeatballsLibraries 3796197817. ~450MB. XLGAMES: FTP folder, do not write WorkshopItems=."
    },
    {
      "kind": "mod",
      "id": "MeatballsCharacter",
      "name": "MEATBALLS Character (B42.20)",
      "source": "local",
      "enabled": true,
      "notes": "5-pack #4. require=MeatballsLibraries. Workshop id pending upload."
    },
    {
      "kind": "mod",
      "id": "MeatballsGameplay",
      "name": "MEATBALLS Gameplay (B42.20)",
      "source": "local",
      "enabled": true,
      "notes": "5-pack #5. require=MeatballsLibraries. Workshop id pending upload."
    }
  ]
}
